{
  "active_skills": [
    {
      "entry": ".codex/skills/math-computation/SKILL.md",
      "entry_sha256": "80c447221725ec198bee4b104d43ca28425110a7dac17afa9cad56ec69b57f48",
      "skill_id": "math-computation",
      "version": "0.6.0",
      "web_status": "constrained"
    },
    {
      "entry": ".codex/skills/math-derivation/SKILL.md",
      "entry_sha256": "3f3b567729f1e5dd24f87e832fdac702577f4add14b8cf6be12d538e1fe787c1",
      "skill_id": "math-derivation",
      "version": "0.4.0",
      "web_status": "active"
    },
    {
      "entry": ".codex/skills/math-discovery/SKILL.md",
      "entry_sha256": "ceb54d773cd970ca42d0243fb1a39b109cab3ffdbe2dd87b98b43539f988d471",
      "skill_id": "math-discovery",
      "version": "0.4.0",
      "web_status": "active"
    },
    {
      "entry": ".codex/skills/math-formalization/SKILL.md",
      "entry_sha256": "8ade921dacd277f425f424064a6002806c057f160555081dbdb4ec05c1f5ea05",
      "skill_id": "math-formalization",
      "version": "0.5.0",
      "web_status": "constrained"
    },
    {
      "entry": ".codex/skills/math-proof/SKILL.md",
      "entry_sha256": "61006c732ad69e73f56be126acb6fa9e25c866e18733ce1f0f3863c1f8eea80f",
      "skill_id": "math-proof",
      "version": "0.5.0",
      "web_status": "active"
    },
    {
      "entry": ".codex/skills/math-toolchain/SKILL.md",
      "entry_sha256": "f6514e01358aa2e40f8b7e3bb9221fd9abca6b7ff37ec6920f2c2cf537533f7b",
      "skill_id": "math-toolchain",
      "version": "0.2.0",
      "web_status": "constrained"
    },
    {
      "entry": ".codex/skills/solve/SKILL.md",
      "entry_sha256": "ff557dc3fc2fa10df4b21e8bef251a37928f5572ccf0092c79f0d9ab90a00ec0",
      "skill_id": "solve",
      "version": "0.3.0",
      "web_status": "active"
    },
    {
      "entry": ".codex/skills/vibe-mathing-router/SKILL.md",
      "entry_sha256": "65f6b25fe152a4cc2fa9ecb03626dad6e3b70473fc256ac9acbabd0ef7cb9e8e",
      "skill_id": "vibe-mathing-router",
      "version": "0.4.0",
      "web_status": "active"
    }
  ],
  "builder": {
    "id": "build-problem-repository",
    "sha256": "aea00b7031d49bc39aa9f3d1ca1b92128e2ad50c5a064063b34ff0a8c2ae96ad",
    "version": "1.1.2"
  },
  "built_at": "2026-09-06T13:26:50+08:00",
  "digest_excludes": [
    "HARNESS_SNAPSHOT.json",
    "WEB_BOOTSTRAP.md"
  ],
  "excludes": [
    ".git",
    ".private",
    ".lake",
    "__pycache__",
    "*.pyc",
    "*.pyo",
    "sessions",
    "raw",
    "derived",
    "staging",
    "vendor/upstream",
    "build"
  ],
  "files": [
    {
      "bytes": 1387,
      "layer": "math_layer",
      "mode": "0644",
      "owner": "harness",
      "path": ".codex/AGENTS.md",
      "sha256": "f0dbdaa90c69bf0cc9286a3275b532edeb3b941741b0707ace19ed07ab2da00a"
    },
    {
      "bytes": 2090,
      "layer": "math_layer",
      "mode": "0644",
      "owner": "harness",
      "path": ".codex/skills/README.md",
      "sha256": "544eb10ce184d0545d728007c636da64085f141d1362366a9fa4ce044a771562"
    },
    {
      "bytes": 1380,
      "layer": "math_layer",
      "mode": "0644",
      "owner": "harness",
      "path": ".codex/skills/math-computation/CHANGELOG.md",
      "sha256": "cd69f3a7f77560319a2c1f67848f6ffa60372734827800cad2ca2ebbfeb4e366"
    },
    {
      "bytes": 6433,
      "layer": "math_layer",
      "mode": "0644",
      "owner": "harness",
      "path": ".codex/skills/math-computation/SKILL.md",
      "sha256": "80c447221725ec198bee4b104d43ca28425110a7dac17afa9cad56ec69b57f48"
    },
    {
      "bytes": 6,
      "layer": "math_layer",
      "mode": "0644",
      "owner": "harness",
      "path": ".codex/skills/math-computation/VERSION",
      "sha256": "97a5d6e540a6120d09c39ddb667e0e8e2bac7fcc2ffef813b82e08fd60365bce"
    },
    {
      "bytes": 227,
      "layer": "math_layer",
      "mode": "0644",
      "owner": "harness",
      "path": ".codex/skills/math-computation/references/index.md",
      "sha256": "d92af8d0d8b9bde6cfcadd58e546e31a855c7c8760f612be6f713d8bcf85609f"
    },
    {
      "bytes": 1154,
      "layer": "math_layer",
      "mode": "0644",
      "owner": "harness",
      "path": ".codex/skills/math-computation/references/pressure-tests.md",
      "sha256": "bca380e00887f904347723fec6953972ce1a2100eacfc29e8d0f806f1ea66316"
    },
    {
      "bytes": 766,
      "layer": "math_layer",
      "mode": "0644",
      "owner": "harness",
      "path": ".codex/skills/math-computation/references/source-map.md",
      "sha256": "a485fcec1a917df09a99df1276df2efff513b530ff952527a97bc8677b0f721c"
    },
    {
      "bytes": 5609,
      "layer": "math_layer",
      "mode": "0644",
      "owner": "harness",
      "path": ".codex/skills/math-computation/references/tool-catalog.md",
      "sha256": "01c0579f42e89af19579aad259ab93e50d30b1a827f17e95dd9702012fb7ce0e"
    },
    {
      "bytes": 572,
      "layer": "math_layer",
      "mode": "0644",
      "owner": "harness",
      "path": ".codex/skills/math-derivation/CHANGELOG.md",
      "sha256": "cf10232d42589a87aa54b4782466c3c854a420d0652a19994f285f01ec3acd3b"
    },
    {
      "bytes": 3245,
      "layer": "math_layer",
      "mode": "0644",
      "owner": "harness",
      "path": ".codex/skills/math-derivation/SKILL.md",
      "sha256": "3f3b567729f1e5dd24f87e832fdac702577f4add14b8cf6be12d538e1fe787c1"
    },
    {
      "bytes": 6,
      "layer": "math_layer",
      "mode": "0644",
      "owner": "harness",
      "path": ".codex/skills/math-derivation/VERSION",
      "sha256": "40b8eb4000a913a7791090535f291d3d369874162a89ef3c9e3d4e887a1b9e79"
    },
    {
      "bytes": 138,
      "layer": "math_layer",
      "mode": "0644",
      "owner": "harness",
      "path": ".codex/skills/math-derivation/references/index.md",
      "sha256": "cfac5585b216a69ea11db338c290d5751bd3f551f71e7cc518231a408c7566ec"
    },
    {
      "bytes": 356,
      "layer": "math_layer",
      "mode": "0644",
      "owner": "harness",
      "path": ".codex/skills/math-derivation/references/pressure-tests.md",
      "sha256": "a8bc0b310371b079bf221c8ba8d738666e5a52df83608f35d745b6789e701df9"
    },
    {
      "bytes": 259,
      "layer": "math_layer",
      "mode": "0644",
      "owner": "harness",
      "path": ".codex/skills/math-derivation/references/source-map.md",
      "sha256": "4079ba1d3f2925c4db76ad54421a5c98bae1c0f3b0f24929d273601b58d81a4e"
    },
    {
      "bytes": 661,
      "layer": "math_layer",
      "mode": "0644",
      "owner": "harness",
      "path": ".codex/skills/math-discovery/CHANGELOG.md",
      "sha256": "2ce91fba1ebe85ce009a8de871ebd335bb08dfc021d76e8c3f55bc779d733572"
    },
    {
      "bytes": 4628,
      "layer": "math_layer",
      "mode": "0644",
      "owner": "harness",
      "path": ".codex/skills/math-discovery/SKILL.md",
      "sha256": "ceb54d773cd970ca42d0243fb1a39b109cab3ffdbe2dd87b98b43539f988d471"
    },
    {
      "bytes": 6,
      "layer": "math_layer",
      "mode": "0644",
      "owner": "harness",
      "path": ".codex/skills/math-discovery/VERSION",
      "sha256": "40b8eb4000a913a7791090535f291d3d369874162a89ef3c9e3d4e887a1b9e79"
    },
    {
      "bytes": 141,
      "layer": "math_layer",
      "mode": "0644",
      "owner": "harness",
      "path": ".codex/skills/math-discovery/references/index.md",
      "sha256": "86ba5d6c1966edc52ccf9ee8b52b80d6db9b15d08277e3c43b57f729e9911939"
    },
    {
      "bytes": 975,
      "layer": "math_layer",
      "mode": "0644",
      "owner": "harness",
      "path": ".codex/skills/math-discovery/references/pressure-tests.md",
      "sha256": "72f1cf195b99f1a7295cfeb63dd4e9c90bfce50156c68ba4af9a291f602bdd4c"
    },
    {
      "bytes": 715,
      "layer": "math_layer",
      "mode": "0644",
      "owner": "harness",
      "path": ".codex/skills/math-discovery/references/source-map.md",
      "sha256": "238fdc36803096e6d5986b5bfb3473e3d319194ca602a5ff0f7b83fd1bab89bf"
    },
    {
      "bytes": 1033,
      "layer": "math_layer",
      "mode": "0644",
      "owner": "harness",
      "path": ".codex/skills/math-formalization/CHANGELOG.md",
      "sha256": "c9e2b7b3a897f66b1f30da07cb56e0904838cc930466601b13d66ad46603f6d6"
    },
    {
      "bytes": 5138,
      "layer": "math_layer",
      "mode": "0644",
      "owner": "harness",
      "path": ".codex/skills/math-formalization/SKILL.md",
      "sha256": "8ade921dacd277f425f424064a6002806c057f160555081dbdb4ec05c1f5ea05"
    },
    {
      "bytes": 6,
      "layer": "math_layer",
      "mode": "0644",
      "owner": "harness",
      "path": ".codex/skills/math-formalization/VERSION",
      "sha256": "a0ad50640139a524f86591157145bf1d4674ea9c065bfea21558f0f7b04430c8"
    },
    {
      "bytes": 142,
      "layer": "math_layer",
      "mode": "0644",
      "owner": "harness",
      "path": ".codex/skills/math-formalization/references/index.md",
      "sha256": "5eab84367ed99f7a8911754519bef286fc2f644dcfab3b0f912c7ebd77a1dec1"
    },
    {
      "bytes": 2462,
      "layer": "math_layer",
      "mode": "0644",
      "owner": "harness",
      "path": ".codex/skills/math-formalization/references/pressure-tests.md",
      "sha256": "35af765cb93466a3dbbcaec70070f287fbbada2394d7e9ae761a89ffd74e5d9b"
    },
    {
      "bytes": 1456,
      "layer": "math_layer",
      "mode": "0644",
      "owner": "harness",
      "path": ".codex/skills/math-formalization/references/source-map.md",
      "sha256": "36963cb6c3a9317c8cd16fa0d1351e3be36770b8311972b3c4a324b26ca53d08"
    },
    {
      "bytes": 955,
      "layer": "math_layer",
      "mode": "0644",
      "owner": "harness",
      "path": ".codex/skills/math-proof/CHANGELOG.md",
      "sha256": "3e283f00401e7a339e82a35bd1c37a820fc5d5e3205fcb9b6c2de9875a6e6828"
    },
    {
      "bytes": 4508,
      "layer": "math_layer",
      "mode": "0644",
      "owner": "harness",
      "path": ".codex/skills/math-proof/SKILL.md",
      "sha256": "61006c732ad69e73f56be126acb6fa9e25c866e18733ce1f0f3863c1f8eea80f"
    },
    {
      "bytes": 6,